{
  "id": "kill_zone_v1",
  "display_name": "Kill Zone V1",
  "tile_size": 128,
  "theme_notes": "Generated fortress exterior for level_003 with deterministic clean playfield and composed grid layer. The background supplies the outer siege frame; grid_layer_composed.png supplies gameplay-critical road, buildable pads, and blocker geometry from level JSON.",
  "background": "res://assets/tilesets/kill_zone_v1/background_frame_clean.png",
  "background_normal": "",
  "grid_layer": "res://assets/tilesets/kill_zone_v1/grid_layer_composed.png",
  "lighting": {
    "normal_light_enabled": false,
    "normal_light_energy": 0.0,
    "normal_light_height": 0.0,
    "normal_light_rotation_degrees": -42.0,
    "normal_light_color": [1.0, 0.96, 0.88, 1.0]
  },
  "tiles": {
    "blocked": "",
    "locked": ""
  }
}
